{
  "schema_version": 1,
  "contract": "pcv-current-evidence-v1",
  "current": {
    "version": "0.42.78-admin-smoke",
    "operator_surfaces": ["web", "cli"],
    "tui_present": false,
    "package_evidence": "docs/ga-ready/evidence/admin-smoke-package-2026-09-25-04278.md",
    "fullgate_batch": "full-admin-host-mutation-gate-20260927-04278-r2",
    "fullgate_evidence": "docs/ga-ready/evidence/full-admin-host-mutation-gate-2026-09-27-04278-r2-hostmutation.md",
    "functional_evidence": "docs/ga-ready/evidence/functional-correctness-actual-host-validation-2026-09-27-04278-carryforward.md",
    "installed_evidence": "docs/ga-ready/evidence/installed-operator-surface-current-card-2026-09-27-04278.md",
    "clean_msi_sha256": "c3390c1e06f77ccb77dc30bd1354c846d09602c28900e3e9e3782d08cc8f5a6d",
    "operational_msi_sha256": "0856d07ee7576a1cd44ca18061e2c9351ddef95271adca0b7b0b319a02d278b6",
    "payload_sha256": "2dfabb939317e4fd6a29b557d98a2d0f35a4197201b8173698737ff8f68ea4bb",
    "provenance_commit": "0de176f12cbfe2bc8f842396159e3c81dfbd3b9b"
  },
  "feature_qualification": {
    "schema_version": 1,
    "contract": "pcv-feature-promotion-decision-v1",
    "promotion_eligible": true,
    "blockers": []
  },
  "manual_admin": {
    "latest_closed_baseline": "0.42.77-admin-smoke",
    "latest_closed_target": "0.42.78-admin-smoke",
    "latest_closed_descriptor": "manual-admin-campaign-descriptor-20260925-04277-04278"
  },
  "claims": {
    "public_trusted_signing": false,
    "external_stable_publication": false
  }
}
